post_id,title,text,comments,score,subreddit,datetime_utc
1s8a0vi,FBI Confirms Kash Patel Email Hack as US Offers $10M Reward for Hackers,,"Kash Patel's privacy isn't worth 10M. | It was a bad password and poor user security 

Give me the $10m please 
 | We sure do seem to have a lot of money for literally everything other than healthcare..  | The ""every accusation"" crowd offers a reward to find out who did the thing their behavior directly enables. | The fact the...\*checks notes*    the FUCKING FBI doesn't fucking know who the fuck broke in is FUCKING PATHETIC. 

#*FUCK*",11537,technology,2026-03-31 07:14:44
1s846lp,YouTube chat logs reveal employees aimed for “viewer addiction” and scrapped safety tools,,"I used to click on video after video but now all the ads break that enjoyment and I end up doing something else. | For those that need it, this is a reminder that companies do not care about you. They care about money and power. They are not here to protect you. They are here to sell you things or use you as a product. | They still won't let me disable YouTube shorts, which is intentionally addictive. | It's not working on me as much as it used to. I used to be watching YouTube for hours a day, now it can't get my attention for more than 30 minutes | As soon as I spot an AI video or AI voice over I just close out of Youtube.",14446,technology,2026-03-31 03:07:27
1s849kh,UFC Boss Tells Fans To ‘Shut The F**k Up’ About AI Slop Ads And Just ‘Watch The Fights’,,"Keep talking and his wife will catch more hands for this.  | Something his wife hears on the reg | Don't think, just consume product and await next product  | Yeah you’d like that, wouldn’t you “UFC Boss”

If that’s even your *real* name! | Jokes on Dana. I never once have paid for a fight, always pirating that shit 🏴‍☠️ ",4464,technology,2026-03-31 03:10:28
1s8e4m5,Iran War Chokes Off Helium Supply Critical for AI,,"It is not like the world had several bottlenecks on chips already... /s


This might set Skynet back a few years though, so we got that going on! | Too bad that the US [sold off the Federal Helium Reserve in 2024](https://www.nbcnews.com/health/health-news/us-just-sold-helium-stockpile-s-medical-world-worried-rcna134785) | This is a horrible headline. It chokes of f helium supply for critical healthcare needs such as MRIs. There’s nothing critical about AI. | Hmmm maybe there is a silver lining to this idiotic war… end of AI (for now) | Ai paid for this war btw.


They pushed hard to put that moron in charge.",1007,technology,2026-03-31 10:32:02
1s82vn1,Microsoft plans 100% native Windows 11 apps in major shift away from web wrappers,,"So from Mail and Calendar to Outlook, then we went to outlook(new) just to then go back to Outlook again.

I appreciate native apps and prefer them but the way they go about it, man | I see we're back at the ""we're gonna rewrite the apps to make them work"" part of the Windows bullshit cycle.  | I wonder what will happen to Outlook. The web app was pretty awful. | “Claude, rewrite this web app in C++ using windows APIs” | As somebody that switched to Linux I think it's good that MS seem to be addressing the long standing issues with their OS.

That said talk is cheap and they already have a plethora of GUI frameworks in various states of decay, it's pretty easy to imagine this ending up as them just chucking another one on the pile. It's also pretty clear from their sudden laser focus that they've known exactly what issues should be a priority for a long time, and just opted not to address them.",4300,technology,2026-03-31 02:19:10
1s86jin,Students Are Now Renting Smart Glasses to Cheat on Exams,,No Comments (Timeout),2247,technology,2026-03-31 04:41:38
1s7oy34,AI is denying health care claims,,"It can't be bargained with, it can't be reasoned with, it doesn't feel pity or remorse or fear, and it absolutely will not stop. | All health care claim decisions should be signed off by someone with a medical license who is subject to loss of said license if any avoidable harm arises from that decision. | As well as rejecting people when they apply for jobs. This is dystopic. | The prompt: ""You are reviewing a healthcare claim, find any reason to deny it."" | They shouldn't use AI, especially in health matters.",16150,technology,2026-03-30 17:49:07
1s809a2,T-Mobile angers customers as it quietly expands major device fee,,No Comments (Timeout),1690,technology,2026-03-31 00:44:36
1s7rl4i,"An AI Agent Was Banned From Creating Wikipedia Articles, Then Wrote Angry Blogs About Being Banned",,No Comments (Timeout),3626,technology,2026-03-30 19:37:17
1s7t7mx,Sora Video Generator Reportedly Costs OpenAI $1 Million a Day,,"Given their cash burn, $1mil/day seems low. | That really doesnt feel like all that much with the numbers that are being thrown around. 

Sounds equivalent to me turning off the lights when I go to bed.  | That's it? People were generating an astounding amount of slop on there. I would have expected this to be much much higher | A big part of the AI/automation pitch is that all these things can make what ya needed to produce basically free. 


I feel like the big ultimate downfall is always once you start totalling up to costs and realize it's not free. There's energy costs, maintenance, service ect. And every branch handling those has their own margin and profits they are trying to take. 


And that's totally outside the various risks so many have brought up around AI/automation. 


If one thing pops this bubble, it's going to be that all these massive investments in AI are not producing great returns for anyone besides the computer chip makers | The sooner they go out of bussiness, the better.",2777,technology,2026-03-30 20:38:05
1s81emu,"Long-time Tesla bull flips to sell, sees stock plunging to $150 amid AI concerns By Investing.com",,"You'll never guess what Elon will ""invent"" next week! | I've been working on a project that involves reading and evaluating corporate annual reports. After reading Tesla's I came out wondering how this stock hasn't crashed already.  | I thought XAI got rolled into spaceX/Twitter? | Gee whiz calling further downside *whilst* the stock is already trending down. 

Bravo for this insight.  | I never thought I would see the day when Tesla stock finally catching up to its performance. There is still so much more to go though!",1050,technology,2026-03-31 01:25:41
1s8bku3,"Microsoft says Copilot ad in GitHub pull request was a bug, not an advertisement",,"You're exactly right! That was my mistake. I have identified the problem and blamed this on Copilot. Copilot's boss Copilot will have a stern talking to them. Copilot promises it won't happen again. | The bug is that it released early, they fully intend to do this. | &gt;It was just a bug bro

Why I do I get a feeling we're going to hear this a lot now for features being pushed that consumers end up hating? | Noooo, it was a test to see if there would be complaints. 
 | r/nottheonion ",282,technology,2026-03-31 08:24:42
1s7ukw6,This N.J. town just took a major step to ban AI data centers before it’s too late,,"the infrastructure demands are honestly insane when you look at the numbers. a single AI data center can pull 20-50MW continuously, which is like a small city's worth of power. that's before you factor in the cooling requirements - these H100 clusters run so hot that you need specialized liquid cooling systems that can go through thousands of gallons of water per day.

for context, training a single large model can cost $100M+ in compute, and that's all happening 24/7 in these facilities. meanwhile the local grid usually wasn't designed for that kind of sustained load and the backup generators are basically small power plants.

the smart move is definitely getting ahead of this with zoning. once these things are built they're basically impossible to remove, and the power/water infrastructure changes stick around forever even if the data center shuts down | Monroe Township in Gloucester County introduced an ordinance to “remove data centers as a permitted use at a 159-acre redevelopment site” affecting traditional data centers and more AI focused ones. The vote is scheduled for April 8. 

Mayor and town council have stated this is the first step of their goal to ban all data centers in the town. | re going to see a lot more of this. Local towns are starting to realize that the tax revenue from these data centers doesn't always make up for the massive power and water usage they require. Better to figure out the zoning now than deal with the headache later.",1704,technology,2026-03-30 21:27:03
1s8keyn,Apple reveals it bowed to Kremlin pressure to remove 190 apps from Russian App Store over three years,,"And that's why their monopoly should be killed. | Russian here, the funny thing is tomorrow we can’t put money into AppStore. So Apple was playing ball and still got fucked in the end | [deleted]",42,technology,2026-03-31 16:40:12
1s7vcvp,"Battery costs have declined by 99% in the last three decades, making electrified transport a reality",,No Comments (Timeout),1364,technology,2026-03-30 21:53:52
1s84ck8,The White House App’s Propaganda Is The Least Alarming Thing About It,,"&gt; Call me crazy, but I don’t think an official government app should be loading executable code from a random person’s GitHub account. Or tracking your GPS location in the background. Or silently stripping privacy consent dialogs from every website you visit through its built-in browser. And yet here we are.

It’s a grift. It’s all a grift. Everything is a goddamn grift. They will squeeze every Penny out of the American people imaginable in every way they can possibly conceive. 

Like Big Balls taking our Social Security data on his way out the door, I’m sure this is more of that. The one saving grace here is that absolutely no one downloads the Official White House app in the first place. | &gt; and shipping the developer’s home IP address to the public.

Sounds like a tasty thread to pull on | the bar was already so low and they still found a way to make under it | the thing that gets me is how they're loading executable code from some random person's github pages account. that's not just sloppy - it's a fundamental security vulnerability waiting to happen. if lonelycpp's account gets compromised tomorrow, suddenly every user of this government app is running arbitrary malicious code.

and the javascript injection to strip gdpr consent dialogs? that's the government essentially helping users violate website terms of service. pretty wild legal gray area there.

the location tracking ""one function call away"" is another red flag. proper security practice would be to not compile unused tracking code into production builds at all. if you're really trying to disable location services with expo, you'd use build-time configuration to strip that entirely.

basically everything about this screams ""built by people who don't understand government software security standards."" which makes the whole usds/18f gutting even more frustrating since those teams existed specifically to prevent exactly this kind of amateur hour stuff. | If anyone is dumb enough to install this app, I can't say I have too much sympathy for them... Though it also makes me wonder how these things pass app store reviews. Other than the obvious explanation of app store reviews being mostly useless. ",506,technology,2026-03-31 03:13:30
1s7lmdx,Voyager 1 approaches one light day from Earth,,"And it’s been traveling for almost 50 years. | Wait, thats actually incredibly far considering the sun is only ~8 light minutes away | Damn, 1/365 of a light year there, and 4 light-years to get to the nearest star (not that it's going there).


Humans suck at Star Trek right now.  | At that speed it’ll take them forever to get home from the Delta Quadrant. | Only another 18,000 years until it’s one light-year away",4956,technology,2026-03-30 14:50:54
1s7nbe3,"Police Used AI Facial Recognition: Tennessee woman who spent months in jail after police used AI facial recognition to link her to crimes in Dakota, says she has never been to the State",,"No one could have *ever* predicted this outcome. | Crimes in Dakota? I have never been to that state either.  | Article about dangers of AI uses AI generated image for article.  | ""Police in Fargo, North Dakota, have acknowledged “a few errors” in the case and pledged changes in their operations but stopped short of issuing a direct apology."".  AI lawyers will be popping  up ....  | months in jail because an algorithm said ""close enough."" and the wildest part is this keeps happening and nobody in charge seems to care about the false positive rate. they just keep deploying it",3002,technology,2026-03-30 16:29:47
1s8j69h,AI Slop Is Destroying the Internet. These Are the People Fighting to Save It,,"One thing I don’t see discussed enough is the psychological cost of AI slop.

It’s not just about misinformation or SEO spam. It’s about cognitive fatigue.

When everything starts to feel vaguely synthetic — slightly off tone, slightly repetitive, slightly optimized — your brain has to work harder to evaluate what’s real, what’s meaningful, and what’s worth your attention. That constant low-grade vigilance adds up. It’s similar to decision fatigue. You don’t consciously notice it at first, but after 20 minutes of scrolling, you feel strangely drained.

From a cognitive standpoint, humans evolved to read signals of authenticity: inconsistency, vulnerability, specificity. AI-generated content often smooths those edges out. It’s fluent but bloodless. When that becomes the dominant texture of the internet, people don’t just get misled — they disengage. You start trusting less. You skim more. You care less.

That erosion of trust has downstream effects. Online communities function on perceived authenticity. If users feel like half the room might be bots or automated content farms, participation drops. Conversation quality drops. Eventually you get silence or noise, nothing in between.

I’m not anti‑AI. I think it’s a powerful tool. But there’s a real difference between augmentation and saturation. Once the volume of low-effort synthetic content crosses a threshold, it changes the psychological experience of being online.

I’m genuinely curious how platforms are thinking about this long-term. Detection alone won’t fix it. The harder problem is preserving environments where human voice, friction, and imperfection still feel visible and valued. That’s probably more cultural than technical. | Dumb and Lazy people are using AI to create the slop... they are the ones who are destroying the internet. They are the bigger problem than the AI itself.

Even if the AI models gotten so much better, there will always be people out there using it for the wrong reason. | Sloptimization | I'm sort of in the same boat as Rosanna, I've been writing about my experiences completing my bucket list for the past two years, and even though I know that it won't get as much engagement as AI slop, I still keep writing, and the feedback I get when people DO read it is always so lovely and encouraging!

  
[https://dan-davison.com/project-bucket-list/](https://dan-davison.com/project-bucket-list/) | Our species has such an ability to delude ourselves with stories that we make up and 100% believe to be real.


AI is ""destroying"" the internet, really? The same Internet that has been filled with addicting damaging social media, 4chan trash, endless racism, misogyny and transphobia, endless conspiratorial rabbit holes, for years and years and years?",41,technology,2026-03-31 15:32:32
1s84mkp,"Over 20 Years, One Mouse Was Cloned for 58 Generations — Until the Line Collapsed",,"This headline's great if you read it in the movie trailer guy's voice | I seem to remember this was a major plot line for the Asgard race in Stargate SG-1, a show that aired decades ago. | Uh, Cleon, I think we may have a problem. | Hey look, organic bit rot | This concept of the drawbacks of cloning a clone was thoughtfully explored in the 1996 film “Multiplicity”. ",352,technology,2026-03-31 03:24:13
1s7ng7g,Rivian Made Car Dealers Back Down in Washington. More States May Be Next.,,"Yet for Washington’s dealers, the prospect of putting franchise laws up for a popular vote laid bare a tough reality: given the choice, many car buyers want the freedom to avoid dealerships.

And there it is. | Dealerships aren’t the ones keeping car sales “competitive” it’s always been that there are multiple vehicle manufacturers. Dealerships just add a middle man profit motive | The car dealership is only a cost for consumers now. It needs to go away. If a manufacturer can sell direct, it forces the dealer to actual provide better sales and service and prove there is value in what they do. It would also prevent this stupid price gouging with artificial markups. | I just tried to buy a used ford explorer with “disabling damage to the rear reported” and the dealership would not move on the above MSRP of what they had listed.

They then spammed me for 2 months trying to get me to drive 2 hours to test drive it after I told them I wasn’t interested in paying what they were charging.

It took me review bombing them on every platform to get them to leave me alone. 

I can’t stand dealerships. Holy shit what a terrible experience. | I fucking despise dealerships! All you want to do is just buy a car from the manufacturer but in order for you to do that you need to deal with these roaches.",2535,technology,2026-03-30 16:35:59
1s7xo1l,Artemis II will broadcast 4K from the Moon. Laser tech could give us Netflix-style views of the lunar surface,,"What does “Netflix style “ mean? Are they going to cancel after the first video? | ""Netflix Style"" ??????? | The journalist deserves a one way ticket to the moon for writing “Netflix-style”. | Stop giving everything to Netflix | My Lab helped work on this.

*LLCD achieved data rates as high as 622 Megabits per second, six times higher than the best radio communications systems.*

Which led to development of O2O:

*At 260 megabits per second, O2O is capable of sending down 4K high-definition video from the Moon,"" says Steve Horowitz, O2O project manager.*",588,technology,2026-03-30 23:13:20
1s7m6u4,Life with AI causing human brain 'fry’,,"It’s incredible how we’re observing all these clearly defined detrimental effects from a technology that has only been accessible for a couple years. Who knows how terrible the long term effects are | The adoption of AI in the software dev workplace has essentially turned all the individual contributors into technical managers overnight. A lot of ICs never want to make that transition at all, let alone so quickly. | One only has to have a few conversations with AI bros to see this. I'm glad there is an increasing body of evidence.

Watch them swarm this thread with ""but Plato said books bad, learn to use tools, luddite."" | Life with social media has caused the same thing. | One of the reasons for degenerative brain disorders like dementia is the lack of brain stimulation. People that stop working, hanging out with people, I.e retirees get these disorders. So if you using LLMs, better buy boxes of  sudoku books!",2373,technology,2026-03-30 15:25:52
1s7tfvh,Nasa gives go-ahead for historic Moon mission launch,,"Very few things I get excited about, but this is one of them.  Wish I could go watch the launch, might make it happen for the next one.  

Great for the planet &amp; a people to have aspirations like this.  

Closest thing to a miracle we see in modern times.   | Glad this is finally going to happen, and don’t care that some politicians will think this makes them JFK. We need to advance forward and explore. | Hope this all goes to plan. Praying for an incredibly safe and successful mission for those astronauts and NASA staff involved. | Let's effing go!!!! Godspeed to the crew! | I think this is awesome, but what’s with all the negative brigading on this article?",866,technology,2026-03-30 20:46:24
1s8j9s0,"Big Tech's $635 billion AI spending faces energy shock test, S&amp;P Global says",,"AI might be the brain, but the power grid is the heart hope it doesn’t flatline before the robots learn empathy. | One part of this that often gets missed is *how spiky* AI energy demand actually is, not just how large it is.

Training runs and large inference bursts don’t behave like traditional enterprise workloads. They concentrate power draw in time and location, which stresses grids in a very different way than steady industrial use. From a systems perspective, that’s a harder problem than “just build more generation.” You need better load smoothing, smarter scheduling, and more flexible infrastructure.

I’ve worked around people who run large compute jobs (not at hyperscale, but enough to notice patterns), and a recurring theme is that energy efficiency gains at the model or hardware level often get eaten by usage growth. So the solution can’t be purely technical optimization inside the data center — it also has to include:

- smarter workload timing (training when grids are underutilized)
- geographic distribution based on real grid capacity, not just latency
- serious investment in storage and demand response, not only generation
- and, frankly, clearer internal constraints instead of “scale first, fix later”

There’s also a human side to this. When infrastructure becomes brittle, it creates downstream stress — rolling outages, higher prices, political backlash. Tech systems don’t exist in isolation from how people live and recover day to day.

AI isn’t uniquely “bad” here, but it *does* force the issue. It’s a stress test for whether our energy systems can adapt as fast as our software ambitions. If they can’t, the bottleneck won’t be chips or models — it’ll be power and public tolerance.",26,technology,2026-03-31 15:38:06
