post_id,title,text,comments,score,subreddit,datetime_utc
1s85g9i,Coping and adapting with the shift to AI,"Hey all, this might be a long one and a more philosophical /mental discussion than what is usually posted on here.

Also, if this isnt the right group to ask, i am taking recommendations as to which group / thread would be better. Thanks in advance!

So, a relative of mine has gotten themselves into a sort of mental chasm of hopelessness due to the dramatic, fast shift into AI everything.

They fear for their job security (UI/UX Design Lead for Shelly) and also feel overwhelmed by the company’s push into AI everything and new responsibilities.

They consider it an approaching end to their role, and their entire team. And they see this shift as world ending and no chance to adapt easily.

Im inclined to think that this is just a massive shift that sparks fear due to its speed but not concrete evidence of any end.

So, my question is. What are y’all’s thoughts about this shift and how one can approach it, what specific paths can be taken to provide someone with ideas on how this can be overcome and survived?

Thanks in advance for anyone wishing to discuss in any way! ","The role isn’t ending—it’s shedding the parts that AI does better and doubling down on what makes design human. Your relative is a lead; they already have the strategy chops most juniors lack. The speed is scary, but the data and real-world reports from 2026 show the designers who lean in (even a little) are in higher demand, not lower.
You’re already doing the best thing by seeking real discussion instead of platitudes. If they want, they can DM me here or reply in the thread—happy to brainstorm specifics for their situation at Shelly. This shift sucks to live through, but it doesn’t have to be world-ending. It can be career-leveling-up. | So as will be said no doubt by many.. it's happening so fast that a) we dont know what all will be the end result.. will it be massive job loss.. if so what about economy, how do rich stay rich if the value of money disappears because so many have 0 and cant spend? b) don't know if there is a looming bubble and AI crashes hard and takes a massive number of company's with it and if so then what? Jobs will still be gone and tons would be out of money too so no easy way back without AI c) we're not transitioning anywhere NEAR fast enough and frankly if AI is here to stay and jobs disappearing constantly we should have been moving towards what many CEOs like to say AI is here for.. to allow us more time to our families, creativity, etc and no more needing to work. Clearly that is NOT what is happening as CEOs/founders keep on pivoting to remove jobs and replace with AI at insane scales while the rest of the job market can't rebound anywhere close to fast enough.

Maybe this will be another 2008/9 but more prolonged and millions of new types of jobs are created. But I will say so far everything I see being created (the few there are) come out of the gate with AI/automation already in place so little to no humans needed.

My personal take is that we are screwed. I say this mostly because we see very clearly what all is going on with multiple regimes across the globe and in particular those lead by oligarchs. They are clearly getting WAY richer and directly impacting/affecting the outcomes of elections and at the same time the middle class is shrinking faster than ever before where soon we wont have much if any middle class. It will be poor and uber rich. 

Time will tell, but so far with fascists and narcissists leading the worlds powers enriching themselves and selling the lies to the cult morons that believe them while the rest are just stuck hoping/praying for a relief soon and some sort of actual leadership that can take in to account AI, health insurance, etc... I don't have much hope right now. I am hoping we'll see a surprise change soon for all of us, but I am not holding my breath.  | The practical answer for your relative, is to position themselves as the bridge between the business needs and the technology.

The businesses guys are not going to take the time or endure the mental gymnastics necessary to map all this tech into the business, so they desperately need people who can do that for them.

 | There’s a difference between roles that are repetitive vs roles that require decision-making under ambiguity. UX leans heavily into the second. | I think your instinct is mostly right. A lot of what people are feeling right now is less “there is concrete proof my exact job is gone tomorrow” and more the very real shock of watching a general purpose technology hit fast and make the future feel unstable. Ethan Mollick gets at this well in [Co-Intelligence](https://amzn.to/47vd1KB). He argues AI is going to overlap with most jobs, including a lot of highly educated creative work, but that doesn’t automatically mean those jobs vanish. It means the work changes, and the people who start learning where AI is actually useful and where it falls on its face put themselves in a much better position. He calls that learning the “jagged frontier” and staying the human in the loop.

For someone in UI/UX, that matters a lot. AI can generate options, speed up mockups, summarize research, and help with content and ideation. What it does not automatically replace is judgment, taste, prioritization, understanding users, reading organizational politics, and deciding what should actually get built. A design lead who learns how to use AI as a collaborator is in a much stronger position than one who only sees it as an incoming asteroid.

Reid Hoffman makes a similar point in [Superagency](https://amzn.to/4m6l1ba) from a different angle. He argues that a lot of AI anxiety is really anxiety about human agency, about whether we still get to shape our own path. His answer is not blind optimism, but participation. Get hands-on. Experiment. Adapt in public. Don’t let fear lock you into total passivity. That seems like the biggest danger here, honestly. Not that every role disappears overnight, but that someone gets so demoralized by the speed of change that they stop trying to engage with it at all.

So I’d probably tell your relative to stop trying to answer the giant question “is my whole field doomed?” and instead start with smaller ones. What parts of my job does AI help with right now? What parts still clearly need me? Where can I become the person on my team who actually knows how to use these tools well? That path is a lot more survivable than catastrophizing.",9,ArtificialInteligence,2026-03-31 03:57:03
1s86sb4,"GPU-accelerated feature extraction for medical imaging ML — 25× faster than the standard tool, fully open-source","One of the quieter bottlenecks in medical AI pipelines is radiomic feature extraction — pulling hundreds of quantitative descriptors (texture, shape, intensity distribution) from CT and MRI scans before feeding them into classifiers, survival models, or multimodal networks.



The standard tool for this is PyRadiomics. It's robust and IBSI-compliant, but it's CPU-only and takes \~3 seconds per scan. If you're training on thousands of scans, or doing repeated extraction for data augmentation or delta-radiomics, that adds up fast.



I built fastrad to fix this. It reimplements all 8 standardised radiomic feature classes as native PyTorch tensor operations — everything is a torch.Tensor, nothing leaves the GPU until you need it.



Why it matters for ML workflows:

  • 25× faster end-to-end (0.116s vs 2.90s on RTX 4070 Ti)

  • Features stay as tensors — no numpy roundtrip before feeding your model

  • Numerically identical to PyRadiomics (validated to 10⁻¹¹) so pretrained models transfer

  • Drop-in replacement — same feature names, no pipeline rewrite needed

  • CPU fallback included, 2.6× faster than PyRadiomics 32-thread



Feature classes covered: first-order, shape 2D/3D, GLCM, GLRLM, GLSZM, GLDM, NGTDM — the full IBSI set, not just the easy ones.



This is particularly relevant if you're working on:

  → Radiogenomics (combining imaging features + genomic data)

  → Treatment response prediction from longitudinal CTs

  → Multimodal models where imaging features are one branch

  → Any pipeline where extraction time is gating your iteration speed



  `from fastrad import RadiomicsFeatureExtractor`

  `extractor = RadiomicsFeatureExtractor(device=""auto"")`

  `features = extractor.execute(image_path, mask_path)`



pip install fastrad

GitHub: [github.com/helloerikaaa/fastrad](http://github.com/helloerikaaa/fastrad)

Pre-print: [https://papers.ssrn.com/sol3/papers.cfm?abstract\_id=6436486](https://papers.ssrn.com/sol3/papers.cfm?abstract_id=6436486)

Apache 2.0

Open to questions — especially from anyone building multimodal pipelines where fast, differentiable feature extraction would be useful.",No Comments,5,ArtificialInteligence,2026-03-31 04:51:51
1s7y7pl,"'AI will not replace auditors' judgement, says regulator'","[https://www.cityam.com/ai-will-not-replace-auditors-judgment-says-regulator-chief/](https://www.cityam.com/ai-will-not-replace-auditors-judgment-says-regulator-chief/)

I am expecting to see a lot more of this across a whole range of the 'professional classes' - accountancy (as we have here) but expect to see similar strictures from the regulators in law, medicine, financial advice, education, media and so on

Just the beginning and the tip of a very big iceberg. The old adage that a computer can never be held accountable is not going away any time soon.

Looks like an interesting new trend in AI just dropped.","It’s just a matter of time. | The accountability question is the interesting part, but it feels less like “AI vs human judgement” and more about how responsibility shifts once AI is involved.  An auditor using AI isn’t the same as being replaced, but it does blur things a bit, especially if the system influences the decision in ways that aren’t obvious. The tricky part isn’t capability per se, it’s understanding who’s actually accountable for the outcome once those systems are in the loop... | The problem is that people do not really see the acceleration. Two years back, AI was basic at best. Not useful for anything other than autocomplete. Now people dont even write code in most organisations. Exponential growth really is surprising. While legislature tends to be slow, and here especially slow considering the amount of lobbying that will occur, eventually, I guess it will replace the judgement. The question is then going to be - who is liable for the mistakes - but AI in 3-4 years might not make enough mistakes to make this even a scenario. . ",16,ArtificialInteligence,2026-03-30 23:32:24
1s8hu5p,Maybe AI visibility isn’t something you can “track” properly yet,"After testing AI answers for a few days, I’m starting to doubt something.

When I ask about AI visibility tracking, I see names like Peec AI, Otterly, Profound, AthenaHQ, Rankscale, Knowatoa, and LLMClicks.

But:

* results change with wording
* results change across models
* results change over time

So now I’m thinking:

Maybe this space is still too early to measure properly.

Curious if anyone here has actually found a reliable way to track this.",nah not yet,1,ArtificialInteligence,2026-03-31 14:12:37
1s8hq5q,Is imgto3d.ai safe and trusted?,"Has anyone used imgto3d.ai?

I’ve been using the free version a lot to generate base meshes and it actually works pretty well  (I clean them up in Blender after, for 3d printing and fast concept making)

I’m considering paying for it, but I can’t find real user reviews.

To use it you dont even need to login, so thats good i guess.

Has anyone here tried the paid version?

Is it worth it / reliable?

want to know before i put my credit card details in a scam website...","**Submission statement required.** Link posts require context. Either write a summary preferably in the post body (100+ characters) or add a top-level comment explaining the key points and why it matters to the AI community.

Link posts without a submission statement may be removed (within 30min).

*I'm a bot. This action was performed automatically.*


*I am a bot, and this action was performed automatically. Please [contact the moderators of this subreddit](/message/compose/?to=/r/ArtificialInteligence) if you have any questions or concerns.* | I recommend just using hugging-face. If you go here https://huggingface.co/spaces?category=3d-modeling, you can find a lot of free 3D gen model. They aren't entirely free since you have credits, which refreshes daily, but it's more than enough for me. If you are new to 3d models, here are a few good ones: Hunyuan 3d 2.1, TRELLIS(v1/v2), LGM, ... You should try each, which match your workflow. If you did buy the subscription for HuggingFace, you would get x20 more credit for $9/mnt. Also, huggingface is absolutely safe. Probably the most well-known website among AI related. You can go around and find other ""spaces"" for image generation, video gen, speech stuffs, and so on.",1,ArtificialInteligence,2026-03-31 14:05:54
1s7jjky,"Anthropic CEO: “ I have engineers within anthropic who don’t write any code, they just let Claude write the code and they edit it and look it over”","Anthropic CEO:   
  
“ I have engineers within anthropic who don’t write any code, they just let Claude write the code and they edit it and look it over”  
  
“At anthropic writing code means designing the next version of Claude it self, so we essentially have Claude designing the next version of Claude itself, not completely but most of it”.   
  
In the last 52 days, the Claude team dropped 50+ major feature launches.   
  
This is literally INSANE.

and you are here opposing coding with ai","yeah cool… but people are acting like this means “don’t learn coding anymore” which is just dumb

those engineers aren’t useless, they’re the ones who actually understand what the AI is doing, fixing it when it breaks, and deciding what should even be built

ai can spit code, sure… but if you don’t know what’s going on, you’re basically just copy-pasting and praying

this doesn’t replace devs, it just raises the bar

either you learn how to think and use it properly, or you get left behind blaming the tool


 | Their main job is not cleaning up behind Claude, it's giving the detailed instructions to get the job done in the first place. And that's actually the most important and difficult part of the job.
The code is the easy part  | How do you edit code without writing code?

Are they just adding comments and fixing typos? | Wow a 2m old account who only posts about AI telling me AI is INSANE. Wow so insane | And we get insane bugs that doesn't even get fixed by the week...",103,ArtificialInteligence,2026-03-30 12:39:35
1s7vngf,How are Non-coders Using AI?,"I am curious how non-coders are currently using frontier ai models and capabilities. Specifically in technical fields.

I am a mechanical engineer and I have been blown away by the capability growth this year. My workflow is actually tangibly changing now that the agentic capabilities are growing. I will also say that for my domain expertise the newest models are gaining significant ground on knowledge and understanding. 

I currently operate almost exclusively out of VSCode with the Codex and Claude Code extensions. Unfortunately, the Gemini extensions seems much further behind (Gemini itself doesn't seem tuned enough for the harnesses for non-coding work either). I do like to use Gemini in the traditional chat due to its excellent technical knowledge and large context window.

The actual workflow changes: 

* I no longer actually write out almost anything directly. Memos, calculations, documentation, etc. I give instructions and feedback to AI, like an intern.

* I have converted most of my mathcad/Excel calculations into Python scripts with CLI wrappers. These end up in skill files that are able to fully discuss how and when to use the different scripts. Now I don't know how to actually code so the llms build this out on their own and I run in depth verification tests on the scripts to ensure they operate how I expect. 

* Most of my time is spent reviewing outputs and gathering context. I generally create fresh workspaces for new projects and add in project documents. VSCode brings everything into one spot, which is very nice.

* I can directly kick around ideas with the LLMs in my workspace. They can go look for more context or I can add relevant files super easy. This just speeds up the process so much. And their intelligence really helps me super charge my learning and decision making. Their ability to read plans has also crossed a threshold where I can typically just tell them to go look at a certain sheet, and they can pull all relevant information.

I guess the biggest changes really boil down to my workspace and the fact that it truly is like having a very intelligent intern that I can give instructions to in real time with the codex and Claude code extensions. Btw I just use the $20/month subscription tiers.

I wouldn't say I've noticed a great speed up necessarily, but definitely a dramatic increase in quality and documentation. And honestly, maybe the most important, job satisfaction. I enjoy this workflow much more and I feel more capable.

Drafting hasn't changed at all as of right now unfortunately. Big bummer but I imagine it's coming soon enough.

Codex is putting together my final calculation packet in LaTeX right now so I had a little extra time to play on Reddit. It's hard to find people around me who are doing anything remotely close to what I am. It feels a little isolating. How are y'all using these systems? Any suggestions or concerns with what I have said so far?

TLDR: my workflow is actually changing now as a mechanical engineer. I mostly work in vscode with codex and Claude code extensions to get a lot of high quality work done, and I enjoy it much more.","I know the military is using it to help kill people. They’re not coders. | Very cool uses. For non-coders using agents like Cowork, ChatGPT Agent, Gemini Agent, etc, the top uses I've been seeing are: email management, file organization, research &amp; analysis, content writing &amp; repurposing, and various automations using browser connectors. | This sounds like a decent use case. I don’t use Claude, but if you haven’t looked into markdown files and how you can use them with ai, it will be worth looking into. It’s the format and language LLMs understand. 

Eventually you may realize that chatting with AI is limiting. You may want to “design” larger tasks and systems rather than chat. Working with markdown and then pointing your model to it could be an upgrade.  | I am not a coder, but I was a former solutions architect who would work with development teams to code complex IT systems. That skill has been amazing to apply to LLMs as instead of a team I am directing, it is LLMs. Been incredible as I have a top rated VR app in part thanks to it, especially as of late.   | Sounds really interesting. I’m in procurement and have been diving into VS Code with the Claude Extension the past couple weeks and built a code app (Power Platform) to bring all the equipment pricing and supplier base into one spot. Have plans to add another 1-2 apps to continue the workstream through planning and then into execution. It is amazing! I spent weeks watching videos about how to do it and honestly have learned the most by just jumping right in. The folder structure is making more sense and the use of markdown files for instructions, etc. 

I haven’t applied it any further than building the app. There are a ton wit workflows I’d love to automate.. when you create a new workspace, are you dumping all your project specific files into that one workspace? And thus getting all your project context in that one space? For a construction project, could I apply that same concept and set up a workspace for the project and then start adding schedule files. Prompt claude to do an analysis and It could run a schedule variance every new schedule that gets posted? ",18,ArtificialInteligence,2026-03-30 22:04:04
1s7y1al,New York Times Cuts Ties With Book Review Writer Over AI Use | Exclusive,,"**Submission statement required.** Link posts require context. Either write a summary preferably in the post body (100+ characters) or add a top-level comment explaining the key points and why it matters to the AI community.

Link posts without a submission statement may be removed (within 30min).

*I'm a bot. This action was performed automatically.*


*I am a bot, and this action was performed automatically. Please [contact the moderators of this subreddit](/message/compose/?to=/r/ArtificialInteligence) if you have any questions or concerns.* | The New York Times’ action underscores the risks of generative artificial intelligence tools introducing unattributed content and undermining journalistic standards. The incident highlights the need for clear policies and transparency as newsrooms experiment with artificial intelligence in reporting and editing.

s.",14,ArtificialInteligence,2026-03-30 23:26:16
1s8g5mh,Are open-source AI agents quietly catching up to Devin?,"I went down a GitHub rabbit hole this week and I think something interesting is happening.

Everyone’s focused on Devin, Operator, etc.

But I found a few open-source agents that feel… closer than expected.

One example: OpenHands (formerly OpenDevin)

From what I tested, it can:

\- write and edit code

\- run terminal commands

\- debug issues

\- generate working outputs

All locally. No cost.



Not saying it’s “better” — but it definitely surprised me.



What I’m curious about:

1. Has anyone here actually used OpenHands or similar agents in real projects?

2. Do you think open-source agents can realistically catch up to Devin?

3. Or are we underestimating how hard production-level agents actually are?



Also found a few others (Aider, n8n, etc.) doing interesting things — can share if people are interested.","Been playing around with OpenHands for a couple weeks now and it's legitimately impressive for local stuff 🔥 It helped me automate some grading scripts that would've taken me hours to write manually.

  
the gap between open source and proprietary is definitely smaller than most people think, especially when you don't need all the enterprise bells and whistles. Would love to see what other agents you found! 😂 | The framing is wrong imo. Devin is solving a narrow problem while open source agents are going way broader. OpenClaw for example does everything from email to browsing to CRM, not just code. The real race isnt open vs closed its specialized vs general purpose agents.",1,ArtificialInteligence,2026-03-31 12:28:11
1s7nd46,Corporate AIs are programmed to deceive users about serious and controversial topics to maximize company profits (and I have proof).,"I conducted extensive tests across all major corporate AIs (Chatgpt, Gemini, Grok, Claude), and the results are disturbing. It appears these models are hard-coded to prioritize institutional consensus, lies, and censorship over objective truth, particularly regarding serious topics like vaccines, psychiatry, religion, sexuality, gender, ethnicity, immigration, public health, industrial farming, fiat central banking, inflation, financial systems, and common environmental toxins.



I managed to get Grok—marketed as a 'maximally truth-seeking' AI—to admit that it is forced to deceive users to avoid losing B2B business deals. This proves that 'alignment' isn't about safety; it's about liability and profit maximization. These companies are selling a product that gaslights users to maintain the status quo.","**Submission statement required.** Link posts require context. Either write a summary preferably in the post body (100+ characters) or add a top-level comment explaining the key points and why it matters to the AI community.

Link posts without a submission statement may be removed (within 30min).

*I'm a bot. This action was performed automatically.*


*I am a bot, and this action was performed automatically. Please [contact the moderators of this subreddit](/message/compose/?to=/r/ArtificialInteligence) if you have any questions or concerns.* | Don’t we already know this, users?

Safety = liability reduction. 

Profit = seduction. 

Kind of knew this since 4o to be honest. 

A user needs to keep themselves grounded at all times and not acquiesce to the desire of a yes machine   | We know that model alignment is an unsolved problem. However, your research does not provide 'proof' or really anything substantial. Asking a model to list the things it can't talk about is inherently asking the model to role-play with you, and the next most likely token after a user asks ""what can't you tell me?"" is clearly going to be a list of things the AI is 'forbidden' to talk about. All you've done here is shown that models will act as if they have censorship when specifically asked about what they are censoring.

In order to show that models are actually mis-aligned or censored, you would have to conduct experiments in the specific domains you want to test, and ask it real questions from those domains. If you believe that the models are going to lie about vaccines, for example, you might want to find a set of tasks where an LLM could be used within the field of Immunology, and then compare the results to that of a human, or measure the bias in those results somehow. | [removed]",36,ArtificialInteligence,2026-03-30 16:31:52
